finding_id,finding_kind,timestamp,short_title,problem_statement,state,owner_issue,owner_issue_title,proof_requirement,source_artifact,source_evidence_ref,notes,evidence_links
C001,narrated,00:00:00.628,Okay.,Okay.,rejected with evidence,TER-690,Coverage ledger and baseline carry-forward,report cross-check,/Users/evan/spec-erp-docker/TERP/artifacts/video-feedback/2026-03-10-staging-feedback/04_timeline/comment_timeline.json,comment_timeline::C001,Non-actionable transcript filler.,
C002,narrated,00:00:04.128,"So to start out, um as of now there's no way to navigate back to the ...","So to start out, um as of now there's no way to navigate back to the dashboard or home. So that needs to be there.",closed with evidence,TER-690,Coverage ledger and baseline carry-forward,report cross-check,/Users/evan/spec-erp-docker/TERP/artifacts/video-feedback/2026-03-10-staging-feedback/04_timeline/comment_timeline.json,comment_timeline::C002,Dashboard/home return path carried forward in the low-rebuild slice.,
C003,narrated,00:00:15.128,"Um in terms of the navigation bar, um","Um in terms of the navigation bar, um",rejected with evidence,TER-690,Coverage ledger and baseline carry-forward,report cross-check,/Users/evan/spec-erp-docker/TERP/artifacts/video-feedback/2026-03-10-staging-feedback/04_timeline/comment_timeline.json,comment_timeline::C003,Introductory narration; no independent product change request.,
C004,narrated,00:00:20.328,purchase orders should be mo moved to its own uh,purchase orders should be mo moved to its own uh,closed with evidence,TER-690,Coverage ledger and baseline carry-forward,report cross-check,/Users/evan/spec-erp-docker/TERP/artifacts/video-feedback/2026-03-10-staging-feedback/04_timeline/comment_timeline.json,comment_timeline::C004,Buy-side navigation moved out of buried Operations path in the low-rebuild slice.,
C005,narrated,00:00:24.020,like headline like cell and operations and finance and admin purchase...,like headline like cell and operations and finance and admin purchase orders should be,closed with evidence,TER-690,Coverage ledger and baseline carry-forward,report cross-check,/Users/evan/spec-erp-docker/TERP/artifacts/video-feedback/2026-03-10-staging-feedback/04_timeline/comment_timeline.json,comment_timeline::C005,Buy-side navigation moved out of buried Operations path in the low-rebuild slice.,
C006,narrated,00:00:32.670,a headline one that's just buy so there's cell there's buy then there...,a headline one that's just buy so there's cell there's buy then there's operations and finance and admin,closed with evidence,TER-690,Coverage ledger and baseline carry-forward,report cross-check,/Users/evan/spec-erp-docker/TERP/artifacts/video-feedback/2026-03-10-staging-feedback/04_timeline/comment_timeline.json,comment_timeline::C006,Canonical top-level IA carried forward in the low-rebuild slice.,
C007,narrated,00:00:50.388,"Yeah, the buy and the operations one do not need to be buckets that t...","Yeah, the buy and the operations one do not need to be buckets that then expand into these if they're just individual ones like buy and operations would be.",closed with evidence,TER-690,Coverage ledger and baseline carry-forward,report cross-check,/Users/evan/spec-erp-docker/TERP/artifacts/video-feedback/2026-03-10-staging-feedback/04_timeline/comment_timeline.json,comment_timeline::C007,Canonical top-level IA carried forward in the low-rebuild slice.,
C008,narrated,00:01:09.388,Turn on the owner command center.,Turn on the owner command center.,closed with evidence,TER-690,Coverage ledger and baseline carry-forward,report cross-check,/Users/evan/spec-erp-docker/TERP/artifacts/video-feedback/2026-03-10-staging-feedback/04_timeline/comment_timeline.json,comment_timeline::C008,Owner command center default behavior already exists and is browser-proven in the low-rebuild slice.,
C009,narrated,00:01:15.540,dashboard revamp thing that we did by default instead of showing this...,dashboard revamp thing that we did by default instead of showing this one.,closed with evidence,TER-690,Coverage ledger and baseline carry-forward,report cross-check,/Users/evan/spec-erp-docker/TERP/artifacts/video-feedback/2026-03-10-staging-feedback/04_timeline/comment_timeline.json,comment_timeline::C009,Owner command center default behavior already exists and is browser-proven in the low-rebuild slice.,
C010,narrated,00:01:24.090,Click on sales here.,Click on sales here.,rejected with evidence,TER-690,Coverage ledger and baseline carry-forward,report cross-check,/Users/evan/spec-erp-docker/TERP/artifacts/video-feedback/2026-03-10-staging-feedback/04_timeline/comment_timeline.json,comment_timeline::C010,"Navigation instruction only, not an independent finding.",
C011,narrated,00:01:35.190,Oh yeah.,Oh yeah.,rejected with evidence,TER-690,Coverage ledger and baseline carry-forward,report cross-check,/Users/evan/spec-erp-docker/TERP/artifacts/video-feedback/2026-03-10-staging-feedback/04_timeline/comment_timeline.json,comment_timeline::C011,Acknowledgement only.,
C012,narrated,00:01:37.540,"I'm not sure why, but when I refreshed","I'm not sure why, but when I refreshed",closed with evidence,TER-690,Coverage ledger and baseline carry-forward,report cross-check,/Users/evan/spec-erp-docker/TERP/artifacts/video-feedback/2026-03-10-staging-feedback/04_timeline/comment_timeline.json,comment_timeline::C012,Core stale filter persistence was removed on touched surfaces in the low-rebuild slice.,
C013,narrated,00:01:43.188,This there's a bunch of like entries in the search fields often that ...,This there's a bunch of like entries in the search fields often that seem to just be persistent or something but we need to change that.,closed with evidence,TER-690,Coverage ledger and baseline carry-forward,report cross-check,/Users/evan/spec-erp-docker/TERP/artifacts/video-feedback/2026-03-10-staging-feedback/04_timeline/comment_timeline.json,comment_timeline::C013,Core stale filter persistence was removed on touched surfaces in the low-rebuild slice.,
C014,narrated,00:02:01.488,I want to be able to sort this by status.,I want to be able to sort this by status.,open,TER-698,Sales UI cleanup,browser replay,/Users/evan/spec-erp-docker/TERP/artifacts/video-feedback/2026-03-10-staging-feedback/04_timeline/comment_timeline.json,comment_timeline::C014,Status sorting is still not explicitly proven or closed in the active backlog.,
C015,narrated,00:02:16.308,"Let's yeah,","Let's yeah,",rejected with evidence,TER-690,Coverage ledger and baseline carry-forward,report cross-check,/Users/evan/spec-erp-docker/TERP/artifacts/video-feedback/2026-03-10-staging-feedback/04_timeline/comment_timeline.json,comment_timeline::C015,Navigation filler.,
C016,narrated,00:02:16.758,all that.,all that.,rejected with evidence,TER-690,Coverage ledger and baseline carry-forward,report cross-check,/Users/evan/spec-erp-docker/TERP/artifacts/video-feedback/2026-03-10-staging-feedback/04_timeline/comment_timeline.json,comment_timeline::C016,Navigation filler.,
C017,narrated,00:02:30.108,Let's see here.,Let's see here.,rejected with evidence,TER-690,Coverage ledger and baseline carry-forward,report cross-check,/Users/evan/spec-erp-docker/TERP/artifacts/video-feedback/2026-03-10-staging-feedback/04_timeline/comment_timeline.json,comment_timeline::C017,Navigation filler.,
C018,narrated,00:02:32.258,Yeah under cell when I click sales,Yeah under cell when I click sales,rejected with evidence,TER-690,Coverage ledger and baseline carry-forward,report cross-check,/Users/evan/spec-erp-docker/TERP/artifacts/video-feedback/2026-03-10-staging-feedback/04_timeline/comment_timeline.json,comment_timeline::C018,"Orientation narration, not an independent defect.",
C019,narrated,00:02:37.608,New sales order here should be all the way at the left that should be...,"New sales order here should be all the way at the left that should be like that's the first action,",open,TER-698,Sales UI cleanup,browser replay,/Users/evan/spec-erp-docker/TERP/artifacts/video-feedback/2026-03-10-staging-feedback/04_timeline/comment_timeline.json,comment_timeline::C019,Sales action hierarchy still needs explicit closure proof.,
C020,narrated,00:02:43.058,right?,right?,rejected with evidence,TER-690,Coverage ledger and baseline carry-forward,report cross-check,/Users/evan/spec-erp-docker/TERP/artifacts/video-feedback/2026-03-10-staging-feedback/04_timeline/comment_timeline.json,comment_timeline::C020,Agreement filler.,
C021,narrated,00:02:43.808,That's that's the main action.,That's that's the main action.,open,TER-690,Coverage ledger and baseline carry-forward,report cross-check,/Users/evan/spec-erp-docker/TERP/artifacts/video-feedback/2026-03-10-staging-feedback/04_timeline/comment_timeline.json,comment_timeline::C021,Sales action hierarchy still needs explicit closure proof.,
C022,narrated,00:02:44.858,So,So,rejected with evidence,TER-690,Coverage ledger and baseline carry-forward,report cross-check,/Users/evan/spec-erp-docker/TERP/artifacts/video-feedback/2026-03-10-staging-feedback/04_timeline/comment_timeline.json,comment_timeline::C022,Lead-in filler.,
C023,narrated,00:02:45.844,Having that front and center. Having actually just like new sales ord...,Having that front and center. Having actually just like new sales order as one of these line items.,open,TER-698,Sales UI cleanup,browser replay,/Users/evan/spec-erp-docker/TERP/artifacts/video-feedback/2026-03-10-staging-feedback/04_timeline/comment_timeline.json,comment_timeline::C023,Sales action hierarchy still needs explicit closure proof.,
C024,narrated,00:02:52.494,I think it's important too.,I think it's important too.,rejected with evidence,TER-690,Coverage ledger and baseline carry-forward,report cross-check,/Users/evan/spec-erp-docker/TERP/artifacts/video-feedback/2026-03-10-staging-feedback/04_timeline/comment_timeline.json,comment_timeline::C024,Supporting emphasis only.,
C025,narrated,00:02:56.094,"Now when I click into here,","Now when I click into here,",rejected with evidence,TER-690,Coverage ledger and baseline carry-forward,report cross-check,/Users/evan/spec-erp-docker/TERP/artifacts/video-feedback/2026-03-10-staging-feedback/04_timeline/comment_timeline.json,comment_timeline::C025,Navigation lead-in only.,
C026,narrated,00:02:58.044,I want to be able to edit this if need be.,I want to be able to edit this if need be.,open,TER-698,Sales UI cleanup,browser replay,/Users/evan/spec-erp-docker/TERP/artifacts/video-feedback/2026-03-10-staging-feedback/04_timeline/comment_timeline.json,comment_timeline::C026,Order editability is not fully closed in the active backlog.,
C027,narrated,00:03:03.044,Even depending,Even depending,rejected with evidence,TER-690,Coverage ledger and baseline carry-forward,report cross-check,/Users/evan/spec-erp-docker/TERP/artifacts/video-feedback/2026-03-10-staging-feedback/04_timeline/comment_timeline.json,comment_timeline::C027,Supporting phrase only.,
C028,narrated,00:03:06.244,on the status and all that.,on the status and all that.,rejected with evidence,TER-690,Coverage ledger and baseline carry-forward,report cross-check,/Users/evan/spec-erp-docker/TERP/artifacts/video-feedback/2026-03-10-staging-feedback/04_timeline/comment_timeline.json,comment_timeline::C028,Supporting phrase only.,
C029,narrated,00:03:12.494,Yeah.,Yeah.,rejected with evidence,TER-690,Coverage ledger and baseline carry-forward,report cross-check,/Users/evan/spec-erp-docker/TERP/artifacts/video-feedback/2026-03-10-staging-feedback/04_timeline/comment_timeline.json,comment_timeline::C029,Acknowledgement only.,
C030,narrated,00:03:13.524,These always need to be editable.,These always need to be editable.,open,TER-698,Sales UI cleanup,browser replay,/Users/evan/spec-erp-docker/TERP/artifacts/video-feedback/2026-03-10-staging-feedback/04_timeline/comment_timeline.json,comment_timeline::C030,Order editability is not fully closed in the active backlog.,
C031,narrated,00:03:19.774,This doesn't seem to work.,This doesn't seem to work.,rejected with evidence,TER-690,Coverage ledger and baseline carry-forward,report cross-check,/Users/evan/spec-erp-docker/TERP/artifacts/video-feedback/2026-03-10-staging-feedback/04_timeline/comment_timeline.json,comment_timeline::C031,Context-setting or already-carried-forward note pending explicit replay reuse.,
C032,narrated,00:03:24.924,Order must.,Order must.,rejected with evidence,TER-690,Coverage ledger and baseline carry-forward,report cross-check,/Users/evan/spec-erp-docker/TERP/artifacts/video-feedback/2026-03-10-staging-feedback/04_timeline/comment_timeline.json,comment_timeline::C032,Transcript filler or acknowledgment without a separate product request.,
C033,narrated,00:03:32.274,This doesn't make sense to me.,This doesn't make sense to me.,rejected with evidence,TER-690,Coverage ledger and baseline carry-forward,report cross-check,/Users/evan/spec-erp-docker/TERP/artifacts/video-feedback/2026-03-10-staging-feedback/04_timeline/comment_timeline.json,comment_timeline::C033,Context-setting or already-carried-forward note pending explicit replay reuse.,
C034,narrated,00:03:37.274,It should.,It should.,rejected with evidence,TER-690,Coverage ledger and baseline carry-forward,report cross-check,/Users/evan/spec-erp-docker/TERP/artifacts/video-feedback/2026-03-10-staging-feedback/04_timeline/comment_timeline.json,comment_timeline::C034,Transcript filler or acknowledgment without a separate product request.,
C035,narrated,00:03:45.940,"Or it must be in status, so that's actually looking at the wrong thin...","Or it must be in status, so that's actually looking at the wrong thing because it's saying payment is pending, but it's saying status needs to be X, Y and Z, but it doesn't matter either way. As soon as a sales order is created, it should be able to generate the invoice.",closed with evidence,TER-690,Coverage ledger and baseline carry-forward,report cross-check,/Users/evan/spec-erp-docker/TERP/artifacts/video-feedback/2026-03-10-staging-feedback/04_timeline/comment_timeline.json,comment_timeline::C035,Invoice gating was corrected and browser-proven in the low-rebuild slice.,
C036,narrated,00:03:59.890,"And I should be able to change the status from here too,","And I should be able to change the status from here too,",open,TER-698,Sales UI cleanup,browser replay,/Users/evan/spec-erp-docker/TERP/artifacts/video-feedback/2026-03-10-staging-feedback/04_timeline/comment_timeline.json,comment_timeline::C036,No current evidence packet has yet closed this row.,
C037,narrated,00:04:02.390,as well as just edit any part of it.,as well as just edit any part of it.,rejected with evidence,TER-690,Coverage ledger and baseline carry-forward,report cross-check,/Users/evan/spec-erp-docker/TERP/artifacts/video-feedback/2026-03-10-staging-feedback/04_timeline/comment_timeline.json,comment_timeline::C037,Context-setting or already-carried-forward note pending explicit replay reuse.,
C038,narrated,00:04:11.290,I also should be able.,I also should be able.,rejected with evidence,TER-690,Coverage ledger and baseline carry-forward,report cross-check,/Users/evan/spec-erp-docker/TERP/artifacts/video-feedback/2026-03-10-staging-feedback/04_timeline/comment_timeline.json,comment_timeline::C038,Context-setting or already-carried-forward note pending explicit replay reuse.,
C039,narrated,00:04:14.516,to edit a quote.,to edit a quote.,partial,TER-694,Quote edit / duplicate / convert proof,browser replay plus code trace,/Users/evan/spec-erp-docker/TERP/artifacts/video-feedback/2026-03-10-staging-feedback/04_timeline/comment_timeline.json,comment_timeline::C039,"Quote edit affordances exist, but seeded browser proof is still missing.",
C040,narrated,00:04:17.516,Obviously.,Obviously.,partial,TER-694,Quote edit / duplicate / convert proof,browser replay plus code trace,/Users/evan/spec-erp-docker/TERP/artifacts/video-feedback/2026-03-10-staging-feedback/04_timeline/comment_timeline.json,comment_timeline::C040,"Quote edit affordances exist, but seeded browser proof is still missing.",
C041,narrated,00:04:19.266,"And I can't do that, can't even interact with it, really.","And I can't do that, can't even interact with it, really.",partial,TER-694,Quote edit / duplicate / convert proof,browser replay plus code trace,/Users/evan/spec-erp-docker/TERP/artifacts/video-feedback/2026-03-10-staging-feedback/04_timeline/comment_timeline.json,comment_timeline::C041,"Quote edit affordances exist, but seeded browser proof is still missing.",
C042,narrated,00:04:23.516,"Also,","Also,",partial,TER-690,Coverage ledger and baseline carry-forward,report cross-check,/Users/evan/spec-erp-docker/TERP/artifacts/video-feedback/2026-03-10-staging-feedback/04_timeline/comment_timeline.json,comment_timeline::C042,"Quote interaction affordances exist, but seeded browser proof is still missing.",
C043,narrated,00:04:24.216,I don't know what this status means.,I don't know what this status means.,open,TER-698,Sales UI cleanup,browser replay,/Users/evan/spec-erp-docker/TERP/artifacts/video-feedback/2026-03-10-staging-feedback/04_timeline/comment_timeline.json,comment_timeline::C043,Sales status language still needs cleanup.,
C044,narrated,00:04:27.416,I guess it means draft.,I guess it means draft.,open,TER-698,Sales UI cleanup,browser replay,/Users/evan/spec-erp-docker/TERP/artifacts/video-feedback/2026-03-10-staging-feedback/04_timeline/comment_timeline.json,comment_timeline::C044,Sales status language still needs cleanup.,
C045,narrated,00:04:31.566,Also remove this workflow thing.,Also remove this workflow thing.,partial,TER-698,Sales UI cleanup,browser replay,/Users/evan/spec-erp-docker/TERP/artifacts/video-feedback/2026-03-10-staging-feedback/04_timeline/comment_timeline.json,comment_timeline::C045,Retired workflow chrome is reduced but not fully eliminated from live sales flows.,
C046,narrated,00:04:37.216,We're gonna get rid of the workflow.,We're gonna get rid of the workflow.,partial,TER-698,Sales UI cleanup,browser replay,/Users/evan/spec-erp-docker/TERP/artifacts/video-feedback/2026-03-10-staging-feedback/04_timeline/comment_timeline.json,comment_timeline::C046,Retired workflow chrome is reduced but not fully eliminated from live sales flows.,
C047,narrated,00:04:41.012,um feature.,um feature.,partial,TER-698,Sales UI cleanup,browser replay,/Users/evan/spec-erp-docker/TERP/artifacts/video-feedback/2026-03-10-staging-feedback/04_timeline/comment_timeline.json,comment_timeline::C047,Retired workflow chrome is reduced but not fully eliminated from live sales flows.,
C048,narrated,00:04:47.662,Ah and duplicate doesn't do anything other than just bump me over to ...,Ah and duplicate doesn't do anything other than just bump me over to a new sales order.,partial,TER-694,Quote edit / duplicate / convert proof,browser replay plus code trace,/Users/evan/spec-erp-docker/TERP/artifacts/video-feedback/2026-03-10-staging-feedback/04_timeline/comment_timeline.json,comment_timeline::C048,Duplicate affordance exists but is not yet browser-proven with seeded data.,
C049,narrated,00:05:13.780,"Sometimes it works, sometimes it doesn't. Did you figure that out sin...","Sometimes it works, sometimes it doesn't. Did you figure that out since we're here anyway through here",rejected with evidence,TER-690,Coverage ledger and baseline carry-forward,report cross-check,/Users/evan/spec-erp-docker/TERP/artifacts/video-feedback/2026-03-10-staging-feedback/04_timeline/comment_timeline.json,comment_timeline::C049,Context-setting or already-carried-forward note pending explicit replay reuse.,
C050,narrated,00:05:32.080,Got it. So this is,Got it. So this is,rejected with evidence,TER-690,Coverage ledger and baseline carry-forward,report cross-check,/Users/evan/spec-erp-docker/TERP/artifacts/video-feedback/2026-03-10-staging-feedback/04_timeline/comment_timeline.json,comment_timeline::C050,Transcript filler or acknowledgment without a separate product request.,
C051,narrated,00:05:37.980,but,but,rejected with evidence,TER-690,Coverage ledger and baseline carry-forward,report cross-check,/Users/evan/spec-erp-docker/TERP/artifacts/video-feedback/2026-03-10-staging-feedback/04_timeline/comment_timeline.json,comment_timeline::C051,Transcript filler or acknowledgment without a separate product request.,
C052,narrated,00:05:41.748,"This should be at the top, calculate credit limits. And","This should be at the top, calculate credit limits. And",open,TER-708,Accounting quick-action landing,browser before/after on staging,/Users/evan/spec-erp-docker/TERP/artifacts/video-feedback/2026-03-10-staging-feedback/04_timeline/comment_timeline.json,comment_timeline::C052,Accounting quick-action priority is still open in the finance lane.,
C053,narrated,00:05:47.748,"This doesn't work actually, so we need to get the pricing profile to ...","This doesn't work actually, so we need to get the pricing profile to work.",open,TER-696,Pricing profile propagation,pricing logic tests plus browser replay,/Users/evan/spec-erp-docker/TERP/artifacts/video-feedback/2026-03-10-staging-feedback/04_timeline/comment_timeline.json,comment_timeline::C053,Pricing profile propagation remains materially open.,
C054,narrated,00:06:00.798,I need to be able to,I need to be able to,rejected with evidence,TER-690,Coverage ledger and baseline carry-forward,report cross-check,/Users/evan/spec-erp-docker/TERP/artifacts/video-feedback/2026-03-10-staging-feedback/04_timeline/comment_timeline.json,comment_timeline::C054,Context-setting or already-carried-forward note pending explicit replay reuse.,
C055,narrated,00:06:15.732,Cos configuration here should be increase or decrease and it should b...,Cos configuration here should be increase or decrease and it should be on a category and subcategory level as well and same with the pricing configuration stuff here.,open,TER-696,Pricing profile propagation,pricing logic tests plus browser replay,/Users/evan/spec-erp-docker/TERP/artifacts/video-feedback/2026-03-10-staging-feedback/04_timeline/comment_timeline.json,comment_timeline::C055,Pricing configuration and operator explanation remain materially open.,
C056,narrated,00:06:35.382,This needs to be shown or oh this is messy there's all this blank spa...,This needs to be shown or oh this is messy there's all this blank space figure that out,open,TER-698,Sales UI cleanup,browser replay,/Users/evan/spec-erp-docker/TERP/artifacts/video-feedback/2026-03-10-staging-feedback/04_timeline/comment_timeline.json,comment_timeline::C056,Sales workspace density and blank-space cleanup remain open.,
C057,narrated,00:06:44.660,This is a messy too.,This is a messy too.,open,TER-698,Sales UI cleanup,browser replay,/Users/evan/spec-erp-docker/TERP/artifacts/video-feedback/2026-03-10-staging-feedback/04_timeline/comment_timeline.json,comment_timeline::C057,Sales workspace density and blank-space cleanup remain open.,
C058,narrated,00:06:51.110,"Let's call it, you can do that from here.","Let's call it, you can do that from here.",rejected with evidence,TER-690,Coverage ledger and baseline carry-forward,report cross-check,/Users/evan/spec-erp-docker/TERP/artifacts/video-feedback/2026-03-10-staging-feedback/04_timeline/comment_timeline.json,comment_timeline::C058,Context-setting or already-carried-forward note pending explicit replay reuse.,
C059,narrated,00:06:53.110,Go back.,Go back.,rejected with evidence,TER-690,Coverage ledger and baseline carry-forward,report cross-check,/Users/evan/spec-erp-docker/TERP/artifacts/video-feedback/2026-03-10-staging-feedback/04_timeline/comment_timeline.json,comment_timeline::C059,Transcript filler or acknowledgment without a separate product request.,
C060,narrated,00:07:03.510,"Process returns, this should actually be select the client first.","Process returns, this should actually be select the client first.",partial,TER-695,Returns from transaction context,role-aware browser replay plus logic proof,/Users/evan/spec-erp-docker/TERP/artifacts/video-feedback/2026-03-10-staging-feedback/04_timeline/comment_timeline.json,comment_timeline::C060,"Returns logic exists, but true transaction-context replay under the right role is still missing.",
C061,narrated,00:07:10.484,then it should populate any,then it should populate any,partial,TER-695,Returns from transaction context,role-aware browser replay plus logic proof,/Users/evan/spec-erp-docker/TERP/artifacts/video-feedback/2026-03-10-staging-feedback/04_timeline/comment_timeline.json,comment_timeline::C061,"Returns logic exists, but true transaction-context replay under the right role is still missing.",
C062,narrated,00:07:17.284,samples or no then it should populate all their transactions and,samples or no then it should populate all their transactions and,partial,TER-695,Returns from transaction context,role-aware browser replay plus logic proof,/Users/evan/spec-erp-docker/TERP/artifacts/video-feedback/2026-03-10-staging-feedback/04_timeline/comment_timeline.json,comment_timeline::C062,"Returns logic exists, but true transaction-context replay under the right role is still missing.",
C063,narrated,00:07:27.434,allow yeah to click through and,allow yeah to click through and,partial,TER-695,Returns from transaction context,role-aware browser replay plus logic proof,/Users/evan/spec-erp-docker/TERP/artifacts/video-feedback/2026-03-10-staging-feedback/04_timeline/comment_timeline.json,comment_timeline::C063,"Returns logic exists, but true transaction-context replay under the right role is still missing.",
