finding_id,finding_kind,timestamp,short_title,problem_statement,state,owner_issue,owner_issue_title,proof_requirement,source_artifact,source_evidence_ref,notes,evidence_links
C064,narrated,00:07:32.884,really should be able to just process the return,really should be able to just process the return,partial,TER-695,Returns from transaction context,role-aware browser replay plus logic proof,/Users/evan/spec-erp-docker/TERP/artifacts/video-feedback/2026-03-10-staging-feedback/04_timeline/comment_timeline.json,comment_timeline::C064,"Returns logic exists, but true transaction-context replay under the right role is still missing.",
C065,narrated,00:07:36.788,from the transaction view.,from the transaction view.,partial,TER-695,Returns from transaction context,role-aware browser replay plus logic proof,/Users/evan/spec-erp-docker/TERP/artifacts/video-feedback/2026-03-10-staging-feedback/04_timeline/comment_timeline.json,comment_timeline::C065,"Returns logic exists, but true transaction-context replay under the right role is still missing.",
C066,narrated,00:07:42.738,The order ID is gonna be really hard.,The order ID is gonna be really hard.,rejected with evidence,TER-690,Coverage ledger and baseline carry-forward,report cross-check,/Users/evan/spec-erp-docker/TERP/artifacts/video-feedback/2026-03-10-staging-feedback/04_timeline/comment_timeline.json,comment_timeline::C066,Context-setting or already-carried-forward note pending explicit replay reuse.,
C067,narrated,00:07:46.688,"And also, this is wrong, right?","And also, this is wrong, right?",rejected with evidence,TER-690,Coverage ledger and baseline carry-forward,report cross-check,/Users/evan/spec-erp-docker/TERP/artifacts/video-feedback/2026-03-10-staging-feedback/04_timeline/comment_timeline.json,comment_timeline::C067,Context-setting or already-carried-forward note pending explicit replay reuse.,
C068,narrated,00:07:53.288,"Okay, yeah.","Okay, yeah.",rejected with evidence,TER-690,Coverage ledger and baseline carry-forward,report cross-check,/Users/evan/spec-erp-docker/TERP/artifacts/video-feedback/2026-03-10-staging-feedback/04_timeline/comment_timeline.json,comment_timeline::C068,Transcript filler or acknowledgment without a separate product request.,
C069,narrated,00:07:55.738,Figure that out.,Figure that out.,rejected with evidence,TER-690,Coverage ledger and baseline carry-forward,report cross-check,/Users/evan/spec-erp-docker/TERP/artifacts/video-feedback/2026-03-10-staging-feedback/04_timeline/comment_timeline.json,comment_timeline::C069,Context-setting or already-carried-forward note pending explicit replay reuse.,
C070,narrated,00:08:02.438,"This is totally blank, unfortunately.","This is totally blank, unfortunately.",partial,TER-698,Sales UI cleanup,browser replay,/Users/evan/spec-erp-docker/TERP/artifacts/video-feedback/2026-03-10-staging-feedback/04_timeline/comment_timeline.json,comment_timeline::C070,"Blank quote-panel failure is improved, but full live flow replay is still needed.",
C071,narrated,00:08:08.628,Also totally blank.,Also totally blank.,partial,TER-698,Sales UI cleanup,browser replay,/Users/evan/spec-erp-docker/TERP/artifacts/video-feedback/2026-03-10-staging-feedback/04_timeline/comment_timeline.json,comment_timeline::C071,"Blank quote-panel failure is improved, but full live flow replay is still needed.",
C072,narrated,00:08:10.478,Get to the new fields order.,Get to the new fields order.,rejected with evidence,TER-690,Coverage ledger and baseline carry-forward,report cross-check,/Users/evan/spec-erp-docker/TERP/artifacts/video-feedback/2026-03-10-staging-feedback/04_timeline/comment_timeline.json,comment_timeline::C072,Context-setting or already-carried-forward note pending explicit replay reuse.,
C073,narrated,00:08:23.928,"Once you select, once we select refer by,","Once you select, once we select refer by,",open,TER-712,Lightweight relationships create/edit flow,browser create/edit replay,/Users/evan/spec-erp-docker/TERP/artifacts/video-feedback/2026-03-10-staging-feedback/04_timeline/comment_timeline.json,comment_timeline::C073,Referral attribution vs compensation home still needs explicit closure mapping.,
C074,narrated,00:08:26.928,that should automatically.,that should automatically.,open,TER-712,Lightweight relationships create/edit flow,browser create/edit replay,/Users/evan/spec-erp-docker/TERP/artifacts/video-feedback/2026-03-10-staging-feedback/04_timeline/comment_timeline.json,comment_timeline::C074,Referral attribution vs compensation home still needs explicit closure mapping.,
C075,narrated,00:08:36.916,stick with the customer moving forward and then there,stick with the customer moving forward and then there,open,TER-712,Lightweight relationships create/edit flow,browser create/edit replay,/Users/evan/spec-erp-docker/TERP/artifacts/video-feedback/2026-03-10-staging-feedback/04_timeline/comment_timeline.json,comment_timeline::C075,Referral attribution vs compensation home still needs explicit closure mapping.,
C076,narrated,00:08:50.416,should be some sort of little box that pops up that,should be some sort of little box that pops up that,open,TER-712,Lightweight relationships create/edit flow,browser create/edit replay,/Users/evan/spec-erp-docker/TERP/artifacts/video-feedback/2026-03-10-staging-feedback/04_timeline/comment_timeline.json,comment_timeline::C076,Referral attribution vs compensation home still needs explicit closure mapping.,
C077,narrated,00:09:01.566,really yeah I think we don't need to worry about,really yeah I think we don't need to worry about,rejected with evidence,TER-712,Lightweight relationships create/edit flow,browser create/edit replay,/Users/evan/spec-erp-docker/TERP/artifacts/video-feedback/2026-03-10-staging-feedback/04_timeline/comment_timeline.json,comment_timeline::C077,Comment narrows scope but does not define a separate defect.,
C078,narrated,00:09:06.260,the percentage right here but this does need to get managed somewhere...,the percentage right here but this does need to get managed somewhere like really the referred by thing should just be tracking all the sales or whatever um and then there,open,TER-712,Lightweight relationships create/edit flow,browser create/edit replay,/Users/evan/spec-erp-docker/TERP/artifacts/video-feedback/2026-03-10-staging-feedback/04_timeline/comment_timeline.json,comment_timeline::C078,Referral settings ownership still needs explicit closure mapping.,
C079,narrated,00:09:21.560,should be a way to manage that somewhere else basically um to decide ...,should be a way to manage that somewhere else basically um to decide like how much percentage or just fixed dollar amount the referee is going to get and that's kind of separate,open,TER-712,Lightweight relationships create/edit flow,browser create/edit replay,/Users/evan/spec-erp-docker/TERP/artifacts/video-feedback/2026-03-10-staging-feedback/04_timeline/comment_timeline.json,comment_timeline::C079,Referral settings ownership still needs explicit closure mapping.,
C080,narrated,00:09:35.924,process that maybe can be handled either probably in relationships.,process that maybe can be handled either probably in relationships.,open,TER-712,Lightweight relationships create/edit flow,browser create/edit replay,/Users/evan/spec-erp-docker/TERP/artifacts/video-feedback/2026-03-10-staging-feedback/04_timeline/comment_timeline.json,comment_timeline::C080,Referral settings ownership still needs explicit closure mapping.,
C081,narrated,00:09:47.024,This is shitty because I don't have to go like this.,This is shitty because I don't have to go like this.,open,TER-698,Sales UI cleanup,browser replay,/Users/evan/spec-erp-docker/TERP/artifacts/video-feedback/2026-03-10-staging-feedback/04_timeline/comment_timeline.json,comment_timeline::C081,No current evidence packet has yet closed this row.,
C082,narrated,00:09:55.924,There's all this blank space here.,There's all this blank space here.,open,TER-698,Sales UI cleanup,browser replay,/Users/evan/spec-erp-docker/TERP/artifacts/video-feedback/2026-03-10-staging-feedback/04_timeline/comment_timeline.json,comment_timeline::C082,No current evidence packet has yet closed this row.,
C083,narrated,00:09:57.824,There's like three different,There's like three different,open,TER-698,Sales UI cleanup,browser replay,/Users/evan/spec-erp-docker/TERP/artifacts/video-feedback/2026-03-10-staging-feedback/04_timeline/comment_timeline.json,comment_timeline::C083,No current evidence packet has yet closed this row.,
C084,narrated,00:10:00.000,"Like yeah, it's nested so many different times over.","Like yeah, it's nested so many different times over.",open,TER-698,Sales UI cleanup,browser replay,/Users/evan/spec-erp-docker/TERP/artifacts/video-feedback/2026-03-10-staging-feedback/04_timeline/comment_timeline.json,comment_timeline::C084,No current evidence packet has yet closed this row.,
C085,narrated,00:10:03.150,It's just a bunch of wasted space,It's just a bunch of wasted space,open,TER-698,Sales UI cleanup,browser replay,/Users/evan/spec-erp-docker/TERP/artifacts/video-feedback/2026-03-10-staging-feedback/04_timeline/comment_timeline.json,comment_timeline::C085,No current evidence packet has yet closed this row.,
C086,narrated,00:10:06.350,We can't have that also I want to be able to edit this stuff and this...,We can't have that also I want to be able to edit this stuff and this should also be showing the price ranges,open,TER-698,Sales UI cleanup,browser replay,/Users/evan/spec-erp-docker/TERP/artifacts/video-feedback/2026-03-10-staging-feedback/04_timeline/comment_timeline.json,comment_timeline::C086,No current evidence packet has yet closed this row.,
C087,narrated,00:10:26.100,This,This,rejected with evidence,TER-698,Sales UI cleanup,browser replay,/Users/evan/spec-erp-docker/TERP/artifacts/video-feedback/2026-03-10-staging-feedback/04_timeline/comment_timeline.json,comment_timeline::C087,Transcript filler or acknowledgment without a separate product request.,
C088,narrated,00:10:27.444,Should be up here all like the customer management shit because I jus...,Should be up here all like the customer management shit because I just want the order preview or no line item should be right here or preview should be done here I'm wondering if this work was already done and,open,TER-698,Sales UI cleanup,browser replay,/Users/evan/spec-erp-docker/TERP/artifacts/video-feedback/2026-03-10-staging-feedback/04_timeline/comment_timeline.json,comment_timeline::C088,No current evidence packet has yet closed this row.,
C089,narrated,00:10:47.344,just lost somewhere because I've already gone through this a few times,just lost somewhere because I've already gone through this a few times,open,TER-698,Sales UI cleanup,browser replay,/Users/evan/spec-erp-docker/TERP/artifacts/video-feedback/2026-03-10-staging-feedback/04_timeline/comment_timeline.json,comment_timeline::C089,No current evidence packet has yet closed this row.,
C090,narrated,00:10:55.444,"This is definitely the wrong place, this whole comfortable thing.","This is definitely the wrong place, this whole comfortable thing.",open,TER-698,Sales UI cleanup,browser replay,/Users/evan/spec-erp-docker/TERP/artifacts/video-feedback/2026-03-10-staging-feedback/04_timeline/comment_timeline.json,comment_timeline::C090,No current evidence packet has yet closed this row.,
C091,narrated,00:10:59.194,I think remove all the comfortable things anywhere but just here.,I think remove all the comfortable things anywhere but just here.,open,TER-698,Sales UI cleanup,browser replay,/Users/evan/spec-erp-docker/TERP/artifacts/video-feedback/2026-03-10-staging-feedback/04_timeline/comment_timeline.json,comment_timeline::C091,No current evidence packet has yet closed this row.,
C092,narrated,00:11:05.894,This is just the only place you should be able to do that.,This is just the only place you should be able to do that.,open,TER-698,Sales UI cleanup,browser replay,/Users/evan/spec-erp-docker/TERP/artifacts/video-feedback/2026-03-10-staging-feedback/04_timeline/comment_timeline.json,comment_timeline::C092,No current evidence packet has yet closed this row.,
C093,narrated,00:11:12.794,"Okay, this","Okay, this",rejected with evidence,TER-690,Coverage ledger and baseline carry-forward,report cross-check,/Users/evan/spec-erp-docker/TERP/artifacts/video-feedback/2026-03-10-staging-feedback/04_timeline/comment_timeline.json,comment_timeline::C093,Transcript filler or acknowledgment without a separate product request.,
C094,narrated,00:11:17.144,"doesn't make any sense either,","doesn't make any sense either,",rejected with evidence,TER-690,Coverage ledger and baseline carry-forward,report cross-check,/Users/evan/spec-erp-docker/TERP/artifacts/video-feedback/2026-03-10-staging-feedback/04_timeline/comment_timeline.json,comment_timeline::C094,Context-setting or already-carried-forward note pending explicit replay reuse.,
C095,narrated,00:11:18.594,unless...,unless...,rejected with evidence,TER-690,Coverage ledger and baseline carry-forward,report cross-check,/Users/evan/spec-erp-docker/TERP/artifacts/video-feedback/2026-03-10-staging-feedback/04_timeline/comment_timeline.json,comment_timeline::C095,Transcript filler or acknowledgment without a separate product request.,
C096,narrated,00:11:29.716,"Yeah, I don't know what this is even doing.","Yeah, I don't know what this is even doing.",rejected with evidence,TER-690,Coverage ledger and baseline carry-forward,report cross-check,/Users/evan/spec-erp-docker/TERP/artifacts/video-feedback/2026-03-10-staging-feedback/04_timeline/comment_timeline.json,comment_timeline::C096,Context-setting or already-carried-forward note pending explicit replay reuse.,
C097,narrated,00:11:38.366,"This needs to be defaulted to something based on the subcategory,","This needs to be defaulted to something based on the subcategory,",open,TER-696,Pricing profile propagation,pricing logic tests plus browser replay,/Users/evan/spec-erp-docker/TERP/artifacts/video-feedback/2026-03-10-staging-feedback/04_timeline/comment_timeline.json,comment_timeline::C097,No current evidence packet has yet closed this row.,
C098,narrated,00:11:45.016,the default margins.,the default margins.,rejected with evidence,TER-690,Coverage ledger and baseline carry-forward,report cross-check,/Users/evan/spec-erp-docker/TERP/artifacts/video-feedback/2026-03-10-staging-feedback/04_timeline/comment_timeline.json,comment_timeline::C098,Context-setting or already-carried-forward note pending explicit replay reuse.,
C099,narrated,00:12:25.716,actually really make sense.,actually really make sense.,rejected with evidence,TER-690,Coverage ledger and baseline carry-forward,report cross-check,/Users/evan/spec-erp-docker/TERP/artifacts/video-feedback/2026-03-10-staging-feedback/04_timeline/comment_timeline.json,comment_timeline::C099,Context-setting or already-carried-forward note pending explicit replay reuse.,
C100,narrated,00:12:31.916,I need to figure that out again within the context because right now ...,I need to figure that out again within the context because right now the way they do it is just like in the spreadsheet where they track everything it's basically just like in,open,TER-706,Photography queue redesign,browser replay,/Users/evan/spec-erp-docker/TERP/artifacts/video-feedback/2026-03-10-staging-feedback/04_timeline/comment_timeline.json,comment_timeline::C100,No current evidence packet has yet closed this row.,
C101,narrated,00:12:48.816,the cogs they just have the price range and then,the cogs they just have the price range and then,open,TER-696,Pricing profile propagation,pricing logic tests plus browser replay,/Users/evan/spec-erp-docker/TERP/artifacts/video-feedback/2026-03-10-staging-feedback/04_timeline/comment_timeline.json,comment_timeline::C101,No current evidence packet has yet closed this row.,
C102,narrated,00:12:54.876,"When they do a sale, they just go back and make a note within","When they do a sale, they just go back and make a note within",rejected with evidence,TER-690,Coverage ledger and baseline carry-forward,report cross-check,/Users/evan/spec-erp-docker/TERP/artifacts/video-feedback/2026-03-10-staging-feedback/04_timeline/comment_timeline.json,comment_timeline::C102,Context-setting or already-carried-forward note pending explicit replay reuse.,
C103,narrated,00:13:02.926,the spreadsheet and that's what I'm trying to kind of like fight or p...,the spreadsheet and that's what I'm trying to kind of like fight or push up against is the simplicity that can come with a spreadsheet.,open,TER-706,Photography queue redesign,browser replay,/Users/evan/spec-erp-docker/TERP/artifacts/video-feedback/2026-03-10-staging-feedback/04_timeline/comment_timeline.json,comment_timeline::C103,No current evidence packet has yet closed this row.,
C104,narrated,00:13:11.026,So can you figure that out?,So can you figure that out?,rejected with evidence,TER-690,Coverage ledger and baseline carry-forward,report cross-check,/Users/evan/spec-erp-docker/TERP/artifacts/video-feedback/2026-03-10-staging-feedback/04_timeline/comment_timeline.json,comment_timeline::C104,Context-setting or already-carried-forward note pending explicit replay reuse.,
C105,narrated,00:13:23.956,"Let's keep that for now,","Let's keep that for now,",rejected with evidence,TER-690,Coverage ledger and baseline carry-forward,report cross-check,/Users/evan/spec-erp-docker/TERP/artifacts/video-feedback/2026-03-10-staging-feedback/04_timeline/comment_timeline.json,comment_timeline::C105,Context-setting or already-carried-forward note pending explicit replay reuse.,
C106,narrated,00:13:25.006,but in general it,but in general it,rejected with evidence,TER-690,Coverage ledger and baseline carry-forward,report cross-check,/Users/evan/spec-erp-docker/TERP/artifacts/video-feedback/2026-03-10-staging-feedback/04_timeline/comment_timeline.json,comment_timeline::C106,Context-setting or already-carried-forward note pending explicit replay reuse.,
C107,narrated,00:13:31.506,should always be,should always be,rejected with evidence,TER-690,Coverage ledger and baseline carry-forward,report cross-check,/Users/evan/spec-erp-docker/TERP/artifacts/video-feedback/2026-03-10-staging-feedback/04_timeline/comment_timeline.json,comment_timeline::C107,Context-setting or already-carried-forward note pending explicit replay reuse.,
C108,narrated,00:13:35.006,FIFO when it comes to specific if there's multiple batches that have ...,FIFO when it comes to specific if there's multiple batches that have come from multiple lots from the same supplier it should be FIFO but,open,TER-697,Margin and FIFO clarity,pricing logic proof plus browser replay,/Users/evan/spec-erp-docker/TERP/artifacts/video-feedback/2026-03-10-staging-feedback/04_timeline/comment_timeline.json,comment_timeline::C108,No current evidence packet has yet closed this row.,
C109,narrated,00:13:52.084,That's only time also,That's only time also,rejected with evidence,TER-690,Coverage ledger and baseline carry-forward,report cross-check,/Users/evan/spec-erp-docker/TERP/artifacts/video-feedback/2026-03-10-staging-feedback/04_timeline/comment_timeline.json,comment_timeline::C109,Context-setting or already-carried-forward note pending explicit replay reuse.,
C110,narrated,00:13:58.384,yeah where,yeah where,rejected with evidence,TER-690,Coverage ledger and baseline carry-forward,report cross-check,/Users/evan/spec-erp-docker/TERP/artifacts/video-feedback/2026-03-10-staging-feedback/04_timeline/comment_timeline.json,comment_timeline::C110,Transcript filler or acknowledgment without a separate product request.,
C111,narrated,00:14:01.934,is the filter for this I'm just wondering if this revamp just got los...,is the filter for this I'm just wondering if this revamp just got lost somewhere okay,open,TER-702,Operations chrome compression,browser replay,/Users/evan/spec-erp-docker/TERP/artifacts/video-feedback/2026-03-10-staging-feedback/04_timeline/comment_timeline.json,comment_timeline::C111,No current evidence packet has yet closed this row.,
C112,narrated,00:14:16.134,so,so,rejected with evidence,TER-690,Coverage ledger and baseline carry-forward,report cross-check,/Users/evan/spec-erp-docker/TERP/artifacts/video-feedback/2026-03-10-staging-feedback/04_timeline/comment_timeline.json,comment_timeline::C112,Transcript filler or acknowledgment without a separate product request.,
C113,narrated,00:14:17.396,"Thank you for finalizing that, but now just bump me back to create sa...","Thank you for finalizing that, but now just bump me back to create sales order. I think it should probably bump back to orders.",open,TER-698,Sales UI cleanup,browser replay,/Users/evan/spec-erp-docker/TERP/artifacts/video-feedback/2026-03-10-staging-feedback/04_timeline/comment_timeline.json,comment_timeline::C113,No current evidence packet has yet closed this row.,
C114,narrated,00:14:26.246,"I don't know what the hell that means, non-fulfillment mode.","I don't know what the hell that means, non-fulfillment mode.",rejected with evidence,TER-690,Coverage ledger and baseline carry-forward,report cross-check,/Users/evan/spec-erp-docker/TERP/artifacts/video-feedback/2026-03-10-staging-feedback/04_timeline/comment_timeline.json,comment_timeline::C114,Context-setting or already-carried-forward note pending explicit replay reuse.,
C115,narrated,00:14:45.684,See if this actually even calculated right.,See if this actually even calculated right.,rejected with evidence,TER-690,Coverage ledger and baseline carry-forward,report cross-check,/Users/evan/spec-erp-docker/TERP/artifacts/video-feedback/2026-03-10-staging-feedback/04_timeline/comment_timeline.json,comment_timeline::C115,Context-setting or already-carried-forward note pending explicit replay reuse.,
C116,narrated,00:15:04.692,"Or it doesn't have validation errors,","Or it doesn't have validation errors,",rejected with evidence,TER-690,Coverage ledger and baseline carry-forward,report cross-check,/Users/evan/spec-erp-docker/TERP/artifacts/video-feedback/2026-03-10-staging-feedback/04_timeline/comment_timeline.json,comment_timeline::C116,Context-setting or already-carried-forward note pending explicit replay reuse.,
C117,narrated,00:15:06.442,it just doesn't have anything in it.,it just doesn't have anything in it.,rejected with evidence,TER-690,Coverage ledger and baseline carry-forward,report cross-check,/Users/evan/spec-erp-docker/TERP/artifacts/video-feedback/2026-03-10-staging-feedback/04_timeline/comment_timeline.json,comment_timeline::C117,Context-setting or already-carried-forward note pending explicit replay reuse.,
C118,narrated,00:15:39.988,So this is confusing because it had a zero margin. And now,So this is confusing because it had a zero margin. And now,open,TER-697,Margin and FIFO clarity,pricing logic proof plus browser replay,/Users/evan/spec-erp-docker/TERP/artifacts/video-feedback/2026-03-10-staging-feedback/04_timeline/comment_timeline.json,comment_timeline::C118,Margin and FIFO explainability remains materially open.,
C119,narrated,00:15:47.288,it has a different margin. So I'm not sure if that's because of the p...,it has a different margin. So I'm not sure if that's because of the price range.,open,TER-697,Margin and FIFO clarity,pricing logic proof plus browser replay,/Users/evan/spec-erp-docker/TERP/artifacts/video-feedback/2026-03-10-staging-feedback/04_timeline/comment_timeline.json,comment_timeline::C119,No current evidence packet has yet closed this row.,
C120,narrated,00:15:53.638,"But either way, I wanna be able to like go back and edit this and may...","But either way, I wanna be able to like go back and edit this and maybe it just bumps back to the you know sales order creation thing and reloads it. I'm not sure, but that definitely needs to get solved.",open,TER-698,Sales UI cleanup,browser replay,/Users/evan/spec-erp-docker/TERP/artifacts/video-feedback/2026-03-10-staging-feedback/04_timeline/comment_timeline.json,comment_timeline::C120,No current evidence packet has yet closed this row.,
C121,narrated,00:16:25.268,Make relationships its own kind of headline one.,Make relationships its own kind of headline one.,closed with evidence,TER-690,Coverage ledger and baseline carry-forward,report cross-check,/Users/evan/spec-erp-docker/TERP/artifacts/video-feedback/2026-03-10-staging-feedback/04_timeline/comment_timeline.json,comment_timeline::C121,Relationships is already promoted to top-level nav in the low-rebuild slice.,
C122,narrated,00:16:32.518,It shouldn't be under self.,It shouldn't be under self.,closed with evidence,TER-690,Coverage ledger and baseline carry-forward,report cross-check,/Users/evan/spec-erp-docker/TERP/artifacts/video-feedback/2026-03-10-staging-feedback/04_timeline/comment_timeline.json,comment_timeline::C122,Relationships is already promoted to top-level nav in the low-rebuild slice.,
C123,narrated,00:16:35.068,"See in see how this just like is automatically there, figure that out.","See in see how this just like is automatically there, figure that out.",closed with evidence,TER-690,Coverage ledger and baseline carry-forward,report cross-check,/Users/evan/spec-erp-docker/TERP/artifacts/video-feedback/2026-03-10-staging-feedback/04_timeline/comment_timeline.json,comment_timeline::C123,Stale relationship search persistence was removed in the low-rebuild slice.,
C124,narrated,00:16:41.868,And then,And then,rejected with evidence,TER-712,Lightweight relationships create/edit flow,browser create/edit replay,/Users/evan/spec-erp-docker/TERP/artifacts/video-feedback/2026-03-10-staging-feedback/04_timeline/comment_timeline.json,comment_timeline::C124,Transcript filler or acknowledgment without a separate product request.,
