finding_id,finding_kind,timestamp,short_title,problem_statement,state,owner_issue,owner_issue_title,proof_requirement,source_artifact,source_evidence_ref,notes,evidence_links
C125,narrated,00:16:45.218,I should say add new client.,I should say add new client.,open,TER-712,Lightweight relationships create/edit flow,browser create/edit replay,/Users/evan/spec-erp-docker/TERP/artifacts/video-feedback/2026-03-10-staging-feedback/04_timeline/comment_timeline.json,comment_timeline::C125,No current evidence packet has yet closed this row.,
C126,narrated,00:16:52.368,We still need okay.,We still need okay.,open,TER-712,Lightweight relationships create/edit flow,browser create/edit replay,/Users/evan/spec-erp-docker/TERP/artifacts/video-feedback/2026-03-10-staging-feedback/04_timeline/comment_timeline.json,comment_timeline::C126,No current evidence packet has yet closed this row.,
C127,narrated,00:16:56.180,"Terry code,","Terry code,",rejected with evidence,TER-712,Lightweight relationships create/edit flow,browser create/edit replay,/Users/evan/spec-erp-docker/TERP/artifacts/video-feedback/2026-03-10-staging-feedback/04_timeline/comment_timeline.json,comment_timeline::C127,Transcript filler or acknowledgment without a separate product request.,
C128,narrated,00:16:57.130,"uh,","uh,",rejected with evidence,TER-712,Lightweight relationships create/edit flow,browser create/edit replay,/Users/evan/spec-erp-docker/TERP/artifacts/video-feedback/2026-03-10-staging-feedback/04_timeline/comment_timeline.json,comment_timeline::C128,Transcript filler or acknowledgment without a separate product request.,
C129,narrated,00:16:57.980,we need to ch- I've said this so many times but we just need to chang...,we need to ch- I've said this so many times but we just need to change this and also we're,open,TER-712,Lightweight relationships create/edit flow,browser create/edit replay,/Users/evan/spec-erp-docker/TERP/artifacts/video-feedback/2026-03-10-staging-feedback/04_timeline/comment_timeline.json,comment_timeline::C129,No current evidence packet has yet closed this row.,
C130,narrated,00:17:10.530,"still using this wizard creation thing,","still using this wizard creation thing,",open,TER-712,Lightweight relationships create/edit flow,browser create/edit replay,/Users/evan/spec-erp-docker/TERP/artifacts/video-feedback/2026-03-10-staging-feedback/04_timeline/comment_timeline.json,comment_timeline::C130,Main relationships entrypoint still uses the heavy wizard.,
C131,narrated,00:17:12.530,"um,","um,",rejected with evidence,TER-712,Lightweight relationships create/edit flow,browser create/edit replay,/Users/evan/spec-erp-docker/TERP/artifacts/video-feedback/2026-03-10-staging-feedback/04_timeline/comment_timeline.json,comment_timeline::C131,Transcript filler or acknowledgment without a separate product request.,
C132,narrated,00:17:13.580,which,which,rejected with evidence,TER-712,Lightweight relationships create/edit flow,browser create/edit replay,/Users/evan/spec-erp-docker/TERP/artifacts/video-feedback/2026-03-10-staging-feedback/04_timeline/comment_timeline.json,comment_timeline::C132,Transcript filler or acknowledgment without a separate product request.,
C133,narrated,00:17:16.080,I thought we were moving away from.,I thought we were moving away from.,open,TER-712,Lightweight relationships create/edit flow,browser create/edit replay,/Users/evan/spec-erp-docker/TERP/artifacts/video-feedback/2026-03-10-staging-feedback/04_timeline/comment_timeline.json,comment_timeline::C133,Main relationships entrypoint still uses the heavy wizard.,
C134,narrated,00:17:17.430,See if other work has been done on this already.,See if other work has been done on this already.,open,TER-712,Lightweight relationships create/edit flow,browser create/edit replay,/Users/evan/spec-erp-docker/TERP/artifacts/video-feedback/2026-03-10-staging-feedback/04_timeline/comment_timeline.json,comment_timeline::C134,No current evidence packet has yet closed this row.,
C135,narrated,00:17:29.044,'Cause yeah.,'Cause yeah.,rejected with evidence,TER-712,Lightweight relationships create/edit flow,browser create/edit replay,/Users/evan/spec-erp-docker/TERP/artifacts/video-feedback/2026-03-10-staging-feedback/04_timeline/comment_timeline.json,comment_timeline::C135,Transcript filler or acknowledgment without a separate product request.,
C136,narrated,00:17:31.394,This should be,This should be,open,TER-711,Relationships terminology cleanup,browser label audit,/Users/evan/spec-erp-docker/TERP/artifacts/video-feedback/2026-03-10-staging-feedback/04_timeline/comment_timeline.json,comment_timeline::C136,Terminology cleanup is not yet complete.,
C137,narrated,00:17:35.094,code name.,code name.,open,TER-711,Relationships terminology cleanup,browser label audit,/Users/evan/spec-erp-docker/TERP/artifacts/video-feedback/2026-03-10-staging-feedback/04_timeline/comment_timeline.json,comment_timeline::C137,Terminology cleanup is not yet complete.,
C138,narrated,00:17:40.094,"Yeah, contact name is fine.","Yeah, contact name is fine.",open,TER-712,Lightweight relationships create/edit flow,browser create/edit replay,/Users/evan/spec-erp-docker/TERP/artifacts/video-feedback/2026-03-10-staging-feedback/04_timeline/comment_timeline.json,comment_timeline::C138,No current evidence packet has yet closed this row.,
C139,narrated,00:17:46.194,"And that should just be signal,","And that should just be signal,",open,TER-711,Relationships terminology cleanup,browser label audit,/Users/evan/spec-erp-docker/TERP/artifacts/video-feedback/2026-03-10-staging-feedback/04_timeline/comment_timeline.json,comment_timeline::C139,Terminology cleanup is not yet complete.,
C140,narrated,00:17:49.244,ID and phone number.,ID and phone number.,open,TER-711,Relationships terminology cleanup,browser label audit,/Users/evan/spec-erp-docker/TERP/artifacts/video-feedback/2026-03-10-staging-feedback/04_timeline/comment_timeline.json,comment_timeline::C140,Terminology cleanup is not yet complete.,
C141,narrated,00:17:55.594,Get rid of the business type thing.,Get rid of the business type thing.,open,TER-712,Lightweight relationships create/edit flow,browser create/edit replay,/Users/evan/spec-erp-docker/TERP/artifacts/video-feedback/2026-03-10-staging-feedback/04_timeline/comment_timeline.json,comment_timeline::C141,Lightweight first-pass field set is not yet complete.,
C142,narrated,00:18:03.572,terms.,terms.,rejected with evidence,TER-712,Lightweight relationships create/edit flow,browser create/edit replay,/Users/evan/spec-erp-docker/TERP/artifacts/video-feedback/2026-03-10-staging-feedback/04_timeline/comment_timeline.json,comment_timeline::C142,Transcript filler or acknowledgment without a separate product request.,
C143,narrated,00:18:10.772,This isn't something that we should set here because it gets set else...,This isn't something that we should set here because it gets set elsewhere unless it's like what's the default.,open,TER-712,Lightweight relationships create/edit flow,browser create/edit replay,/Users/evan/spec-erp-docker/TERP/artifacts/video-feedback/2026-03-10-staging-feedback/04_timeline/comment_timeline.json,comment_timeline::C143,No current evidence packet has yet closed this row.,
C144,narrated,00:18:20.672,I guess this could say default and get rid of the address.,I guess this could say default and get rid of the address.,open,TER-712,Lightweight relationships create/edit flow,browser create/edit replay,/Users/evan/spec-erp-docker/TERP/artifacts/video-feedback/2026-03-10-staging-feedback/04_timeline/comment_timeline.json,comment_timeline::C144,Lightweight first-pass field set is not yet complete.,
C145,narrated,00:19:03.028,"This doesn't matter right now, but it shouldn't be an email,","This doesn't matter right now, but it shouldn't be an email,",open,TER-711,Relationships terminology cleanup,browser label audit,/Users/evan/spec-erp-docker/TERP/artifacts/video-feedback/2026-03-10-staging-feedback/04_timeline/comment_timeline.json,comment_timeline::C145,Username/email terminology cleanup is not yet complete.,
C146,narrated,00:19:06.228,it should be a username.,it should be a username.,open,TER-711,Relationships terminology cleanup,browser label audit,/Users/evan/spec-erp-docker/TERP/artifacts/video-feedback/2026-03-10-staging-feedback/04_timeline/comment_timeline.json,comment_timeline::C146,Username/email terminology cleanup is not yet complete.,
C147,narrated,00:19:46.452,I don't do this.,I don't do this.,open,TER-712,Lightweight relationships create/edit flow,browser create/edit replay,/Users/evan/spec-erp-docker/TERP/artifacts/video-feedback/2026-03-10-staging-feedback/04_timeline/comment_timeline.json,comment_timeline::C147,No current evidence packet has yet closed this row.,
C148,narrated,00:20:12.948,I shouldn't be showing system inventory here. This would just be like...,I shouldn't be showing system inventory here. This would just be like related to their own,open,TER-712,Lightweight relationships create/edit flow,browser create/edit replay,/Users/evan/spec-erp-docker/TERP/artifacts/video-feedback/2026-03-10-staging-feedback/04_timeline/comment_timeline.json,comment_timeline::C148,No current evidence packet has yet closed this row.,
C149,narrated,00:20:17.698,profile.,profile.,rejected with evidence,TER-712,Lightweight relationships create/edit flow,browser create/edit replay,/Users/evan/spec-erp-docker/TERP/artifacts/video-feedback/2026-03-10-staging-feedback/04_timeline/comment_timeline.json,comment_timeline::C149,Transcript filler or acknowledgment without a separate product request.,
C150,narrated,00:20:20.548,"So like either like just their transit, maybe it's this.","So like either like just their transit, maybe it's this.",open,TER-712,Lightweight relationships create/edit flow,browser create/edit replay,/Users/evan/spec-erp-docker/TERP/artifacts/video-feedback/2026-03-10-staging-feedback/04_timeline/comment_timeline.json,comment_timeline::C150,No current evidence packet has yet closed this row.,
C151,narrated,00:20:31.848,Get rid of this. Quick notes is good probably.,Get rid of this. Quick notes is good probably.,open,TER-712,Lightweight relationships create/edit flow,browser create/edit replay,/Users/evan/spec-erp-docker/TERP/artifacts/video-feedback/2026-03-10-staging-feedback/04_timeline/comment_timeline.json,comment_timeline::C151,No current evidence packet has yet closed this row.,
C152,narrated,00:20:42.324,"Okay, that's cool. Um but it needs to show somewhere like saved or ok...","Okay, that's cool. Um but it needs to show somewhere like saved or okay what's that uh it's still be good to just have like a save right here and a li little like some way of",open,TER-712,Lightweight relationships create/edit flow,browser create/edit replay,/Users/evan/spec-erp-docker/TERP/artifacts/video-feedback/2026-03-10-staging-feedback/04_timeline/comment_timeline.json,comment_timeline::C152,Relationship save-state visibility is not yet complete.,
C153,narrated,00:21:00.824,"like if these run two different days, it'd be good to show that they'...","like if these run two different days, it'd be good to show that they're two different entries and date that both of them are put in.",open,TER-712,Lightweight relationships create/edit flow,browser create/edit replay,/Users/evan/spec-erp-docker/TERP/artifacts/video-feedback/2026-03-10-staging-feedback/04_timeline/comment_timeline.json,comment_timeline::C153,Relationship save-history visibility is not yet complete.,
C154,narrated,00:21:08.974,Get rid of the comments thing for now.,Get rid of the comments thing for now.,rejected with evidence,TER-690,Coverage ledger and baseline carry-forward,report cross-check,/Users/evan/spec-erp-docker/TERP/artifacts/video-feedback/2026-03-10-staging-feedback/04_timeline/comment_timeline.json,comment_timeline::C154,Context-setting or already-carried-forward note pending explicit replay reuse.,
C155,narrated,00:21:39.508,They're just it's so busy.,They're just it's so busy.,open,TER-702,Operations chrome compression,browser replay,/Users/evan/spec-erp-docker/TERP/artifacts/video-feedback/2026-03-10-staging-feedback/04_timeline/comment_timeline.json,comment_timeline::C155,No current evidence packet has yet closed this row.,
C156,narrated,00:21:42.508,"There's all these, there's all these then there's all this below.","There's all these, there's all these then there's all this below.",open,TER-702,Operations chrome compression,browser replay,/Users/evan/spec-erp-docker/TERP/artifacts/video-feedback/2026-03-10-staging-feedback/04_timeline/comment_timeline.json,comment_timeline::C156,No current evidence packet has yet closed this row.,
C157,narrated,00:21:47.408,Across the board this just needs to get figured out.,Across the board this just needs to get figured out.,open,TER-702,Operations chrome compression,browser replay,/Users/evan/spec-erp-docker/TERP/artifacts/video-feedback/2026-03-10-staging-feedback/04_timeline/comment_timeline.json,comment_timeline::C157,No current evidence packet has yet closed this row.,
C158,narrated,00:21:55.458,Only this for now.,Only this for now.,open,TER-702,Operations chrome compression,browser replay,/Users/evan/spec-erp-docker/TERP/artifacts/video-feedback/2026-03-10-staging-feedback/04_timeline/comment_timeline.json,comment_timeline::C158,No current evidence packet has yet closed this row.,
C159,narrated,00:22:04.458,For all the advanced filters like it takes up too much space.,For all the advanced filters like it takes up too much space.,open,TER-702,Operations chrome compression,browser replay,/Users/evan/spec-erp-docker/TERP/artifacts/video-feedback/2026-03-10-staging-feedback/04_timeline/comment_timeline.json,comment_timeline::C159,No current evidence packet has yet closed this row.,
C160,narrated,00:22:09.012,right now.,right now.,rejected with evidence,TER-702,Operations chrome compression,browser replay,/Users/evan/spec-erp-docker/TERP/artifacts/video-feedback/2026-03-10-staging-feedback/04_timeline/comment_timeline.json,comment_timeline::C160,Transcript filler or acknowledgment without a separate product request.,
C161,narrated,00:22:11.262,Um,Um,rejected with evidence,TER-702,Operations chrome compression,browser replay,/Users/evan/spec-erp-docker/TERP/artifacts/video-feedback/2026-03-10-staging-feedback/04_timeline/comment_timeline.json,comment_timeline::C161,Transcript filler or acknowledgment without a separate product request.,
C162,narrated,00:22:14.112,yeah. We just need to do like a refresh of the U_I_ and U_X_ for the ...,yeah. We just need to do like a refresh of the U_I_ and U_X_ for the advanced filters 'cause this is,open,TER-702,Operations chrome compression,browser replay,/Users/evan/spec-erp-docker/TERP/artifacts/video-feedback/2026-03-10-staging-feedback/04_timeline/comment_timeline.json,comment_timeline::C162,No current evidence packet has yet closed this row.,
C163,narrated,00:22:22.612,If it just looks horrible and it's h,If it just looks horrible and it's h,open,TER-702,Operations chrome compression,browser replay,/Users/evan/spec-erp-docker/TERP/artifacts/video-feedback/2026-03-10-staging-feedback/04_timeline/comment_timeline.json,comment_timeline::C163,No current evidence packet has yet closed this row.,
C164,narrated,00:22:24.712,"confusing and hard to know and Jesus yeah, let's just apply these thi...","confusing and hard to know and Jesus yeah, let's just apply these things far apart from each other because of these it's just really bad.",open,TER-702,Operations chrome compression,browser replay,/Users/evan/spec-erp-docker/TERP/artifacts/video-feedback/2026-03-10-staging-feedback/04_timeline/comment_timeline.json,comment_timeline::C164,No current evidence packet has yet closed this row.,
C165,narrated,00:22:51.380,so I see.,so I see.,rejected with evidence,TER-690,Coverage ledger and baseline carry-forward,report cross-check,/Users/evan/spec-erp-docker/TERP/artifacts/video-feedback/2026-03-10-staging-feedback/04_timeline/comment_timeline.json,comment_timeline::C165,Transcript filler or acknowledgment without a separate product request.,
C166,narrated,00:22:54.330,"Yeah, inventory needs to be","Yeah, inventory needs to be",open,TER-703,Inventory first-class workspace,browser replay plus route/IA proof,/Users/evan/spec-erp-docker/TERP/artifacts/video-feedback/2026-03-10-staging-feedback/04_timeline/comment_timeline.json,comment_timeline::C166,Inventory is still nested inside Operations rather than being a first-class workspace.,
C167,narrated,00:22:58.880,bubbled up as its own thing.,bubbled up as its own thing.,open,TER-703,Inventory first-class workspace,browser replay plus route/IA proof,/Users/evan/spec-erp-docker/TERP/artifacts/video-feedback/2026-03-10-staging-feedback/04_timeline/comment_timeline.json,comment_timeline::C167,Inventory is still nested inside Operations rather than being a first-class workspace.,
C168,narrated,00:23:07.630,And then actions from there.,And then actions from there.,open,TER-703,Inventory first-class workspace,browser replay plus route/IA proof,/Users/evan/spec-erp-docker/TERP/artifacts/video-feedback/2026-03-10-staging-feedback/04_timeline/comment_timeline.json,comment_timeline::C168,Inventory is still nested inside Operations rather than being a first-class workspace.,
C169,narrated,00:23:18.420,"This looks really messy right now, it's confusing.","This looks really messy right now, it's confusing.",open,TER-702,Operations chrome compression,browser replay,/Users/evan/spec-erp-docker/TERP/artifacts/video-feedback/2026-03-10-staging-feedback/04_timeline/comment_timeline.json,comment_timeline::C169,No current evidence packet has yet closed this row.,
C170,narrated,00:23:22.570,Like this a drop-down.,Like this a drop-down.,open,TER-703,Inventory first-class workspace,browser replay plus route/IA proof,/Users/evan/spec-erp-docker/TERP/artifacts/video-feedback/2026-03-10-staging-feedback/04_timeline/comment_timeline.json,comment_timeline::C170,No current evidence packet has yet closed this row.,
C171,narrated,00:23:24.820,Because right now like it's like why?,Because right now like it's like why?,open,TER-703,Inventory first-class workspace,browser replay plus route/IA proof,/Users/evan/spec-erp-docker/TERP/artifacts/video-feedback/2026-03-10-staging-feedback/04_timeline/comment_timeline.json,comment_timeline::C171,No current evidence packet has yet closed this row.,
C172,narrated,00:23:26.970,That doesn't work anyway. But um,That doesn't work anyway. But um,open,TER-703,Inventory first-class workspace,browser replay plus route/IA proof,/Users/evan/spec-erp-docker/TERP/artifacts/video-feedback/2026-03-10-staging-feedback/04_timeline/comment_timeline.json,comment_timeline::C172,No current evidence packet has yet closed this row.,
C173,narrated,00:23:29.720,"Yeah, update the status via drop-down on these different things.","Yeah, update the status via drop-down on these different things.",open,TER-699,Shipping vocabulary simplification,status mapping artifact plus browser replay,/Users/evan/spec-erp-docker/TERP/artifacts/video-feedback/2026-03-10-staging-feedback/04_timeline/comment_timeline.json,comment_timeline::C173,No current evidence packet has yet closed this row.,
C174,narrated,00:23:42.620,This shouldn't just be about,This shouldn't just be about,open,TER-703,Inventory first-class workspace,browser replay plus route/IA proof,/Users/evan/spec-erp-docker/TERP/artifacts/video-feedback/2026-03-10-staging-feedback/04_timeline/comment_timeline.json,comment_timeline::C174,No current evidence packet has yet closed this row.,
C175,narrated,00:23:45.140,"No this shouldn't, receive and receive. This should, you shouldn't ha...","No this shouldn't, receive and receive. This should, you shouldn't have to put in your own things. This should basically be uh attached to purchase orders and you come in and you can select the supplier and then see the open purchase orders that haven't been through receiving yet and then yeah you should basically be able to",partial,TER-690,Coverage ledger and baseline carry-forward,report cross-check,/Users/evan/spec-erp-docker/TERP/artifacts/video-feedback/2026-03-10-staging-feedback/04_timeline/comment_timeline.json,comment_timeline::C175,"PO-driven receiving handoff exists and is browser-proven, but the full receiving lifecycle is not yet closed.",
C176,narrated,00:24:13.652,you have all the line items,you have all the line items,partial,TER-690,Coverage ledger and baseline carry-forward,report cross-check,/Users/evan/spec-erp-docker/TERP/artifacts/video-feedback/2026-03-10-staging-feedback/04_timeline/comment_timeline.json,comment_timeline::C176,"PO-driven receiving handoff exists and is browser-proven, but the full receiving lifecycle is not yet closed.",
C177,narrated,00:24:22.802,"Yeah, it should just like you should be able to confirm them should a...","Yeah, it should just like you should be able to confirm them should also be able to change",partial,TER-690,Coverage ledger and baseline carry-forward,report cross-check,/Users/evan/spec-erp-docker/TERP/artifacts/video-feedback/2026-03-10-staging-feedback/04_timeline/comment_timeline.json,comment_timeline::C177,"PO-driven receiving handoff exists and is browser-proven, but editable variance handling is not yet fully closed.",
C178,narrated,00:24:31.452,anything about any of the line items that should flow through the res...,anything about any of the line items that should flow through the rest of the system obviously if you do change it like sometimes you know they'll,partial,TER-690,Coverage ledger and baseline carry-forward,report cross-check,/Users/evan/spec-erp-docker/TERP/artifacts/video-feedback/2026-03-10-staging-feedback/04_timeline/comment_timeline.json,comment_timeline::C178,"PO-driven receiving handoff exists and is browser-proven, but editable variance handling is not yet fully closed.",
C179,narrated,00:24:38.644,Maybe drop off not enough or you know you might need to reject a unit...,Maybe drop off not enough or you know you might need to reject a unit or two or something like that so all that should be in receiving not like creating new items or something because the only time you ever do receiving is after there's already some sort of purchase order.,partial,TER-690,Coverage ledger and baseline carry-forward,report cross-check,/Users/evan/spec-erp-docker/TERP/artifacts/video-feedback/2026-03-10-staging-feedback/04_timeline/comment_timeline.json,comment_timeline::C179,"PO-driven receiving handoff exists and is browser-proven, but editable variance handling is not yet fully closed.",
C180,narrated,00:25:04.372,Which I guess you should be able to do from here.,Which I guess you should be able to do from here.,open,TER-703,Inventory first-class workspace,browser replay plus route/IA proof,/Users/evan/spec-erp-docker/TERP/artifacts/video-feedback/2026-03-10-staging-feedback/04_timeline/comment_timeline.json,comment_timeline::C180,No current evidence packet has yet closed this row.,
C181,narrated,00:25:07.722,Let's create a purchase order too just in case,Let's create a purchase order too just in case,open,TER-703,Inventory first-class workspace,browser replay plus route/IA proof,/Users/evan/spec-erp-docker/TERP/artifacts/video-feedback/2026-03-10-staging-feedback/04_timeline/comment_timeline.json,comment_timeline::C181,No current evidence packet has yet closed this row.,
C182,narrated,00:25:12.272,This looks like the old UI in US and again like this is stuck in ther...,This looks like the old UI in US and again like this is stuck in there for some reason,open,TER-700,Shipping truthfulness and stale filters,browser replay,/Users/evan/spec-erp-docker/TERP/artifacts/video-feedback/2026-03-10-staging-feedback/04_timeline/comment_timeline.json,comment_timeline::C182,Shipping false-empty/stale-state behavior is still open.,
C183,narrated,00:25:27.422,You can't do anything,You can't do anything,partial,TER-701,Shipping operator proof,role-aware browser replay,/Users/evan/spec-erp-docker/TERP/artifacts/video-feedback/2026-03-10-staging-feedback/04_timeline/comment_timeline.json,comment_timeline::C183,"Shipping actions exist, but role-aware end-to-end proof is still missing.",
C184,narrated,00:25:30.672,Market's ready for payment.,Market's ready for payment.,open,TER-699,Shipping vocabulary simplification,status mapping artifact plus browser replay,/Users/evan/spec-erp-docker/TERP/artifacts/video-feedback/2026-03-10-staging-feedback/04_timeline/comment_timeline.json,comment_timeline::C184,Shipping vocabulary still shows invalid operator-facing language.,
C185,narrated,00:25:31.972,Don't do that,Don't do that,open,TER-703,Inventory first-class workspace,browser replay plus route/IA proof,/Users/evan/spec-erp-docker/TERP/artifacts/video-feedback/2026-03-10-staging-feedback/04_timeline/comment_timeline.json,comment_timeline::C185,No current evidence packet has yet closed this row.,
C186,narrated,00:25:34.676,That shouldn't be right.,That shouldn't be right.,open,TER-703,Inventory first-class workspace,browser replay plus route/IA proof,/Users/evan/spec-erp-docker/TERP/artifacts/video-feedback/2026-03-10-staging-feedback/04_timeline/comment_timeline.json,comment_timeline::C186,No current evidence packet has yet closed this row.,
C187,narrated,00:25:35.526,That is like shipping.,That is like shipping.,open,TER-699,Shipping vocabulary simplification,status mapping artifact plus browser replay,/Users/evan/spec-erp-docker/TERP/artifacts/video-feedback/2026-03-10-staging-feedback/04_timeline/comment_timeline.json,comment_timeline::C187,Shipping lifecycle terminology still needs simplification.,
